{
  "$schema": "schemas/contracts.schema.json",
  "project": "auracode",
  "version": "0.3.0.dev0",
  "assurance_level": "AL2",
  "layers": {
    "auracode": {
      "path": "auracode/*.py",
      "description": "Public programmatic API facade and package entrypoint.",
      "forbidden_imports": [
        "validation.scenarios",
        "requests",
        "httpx",
        "flask",
        "django",
        "fastapi"
      ],
      "allow_wildcard_imports": false,
      "max_file_lines": 1000
    },
    "tools": {
      "path": "tools/*.py",
      "description": "Core active governance and software assurance engines. Pure Python standard library only.",
      "forbidden_imports": [
        "validation.scenarios",
        "requests",
        "httpx",
        "flask",
        "django",
        "fastapi"
      ],
      "allow_wildcard_imports": false,
      "max_file_lines": 1000
    },
    "validation_tools": {
      "path": "validation/tools/*.py",
      "description": "Empirical evaluation harness and isolation runners.",
      "forbidden_imports": [
        "requests",
        "httpx"
      ],
      "allow_wildcard_imports": false,
      "max_file_lines": 1000
    },
    "tests": {
      "path": "tests/*.py",
      "description": "Unit and integration test suites for framework governance and verification engines.",
      "forbidden_imports": [
        "requests",
        "httpx",
        "flask",
        "django",
        "fastapi"
      ],
      "allow_wildcard_imports": false,
      "max_file_lines": 1000
    }
  },
  "global_rules": {
    "allow_wildcard_imports": false,
    "max_file_lines": 1000
  }
}
